{
  "address": "0x5E669c1f2F9629B22dd05FBff63313a49f87D4e6",
  "abi": [
    {
      "inputs": [],
      "name": "InvalidECDSASignatureLength",
      "type": "error"
    },
    {
      "inputs": [],
      "name": "InvalidSignature",
      "type": "error"
    },
    {
      "inputs": [],
      "name": "InvalidSignatureSValue",
      "type": "error"
    },
    {
      "inputs": [
        {
          "internalType": "address",
          "name": "signer",
          "type": "address"
        },
        {
          "internalType": "bytes32",
          "name": "safeTxHash",
          "type": "bytes32"
        }
      ],
      "name": "SignerAlreadySignedTransaction",
      "type": "error"
    },
    {
      "inputs": [],
      "name": "ValueDoesNotFitInUint128",
      "type": "error"
    },
    {
      "anonymous": false,
      "inputs": [
        {
          "indexed": true,
          "internalType": "bytes32",
          "name": "safeTxHash",
          "type": "bytes32"
        },
        {
          "indexed": true,
          "internalType": "address",
          "name": "safe",
          "type": "address"
        },
        {
          "indexed": true,
          "internalType": "uint256",
          "name": "chainId",
          "type": "uint256"
        },
        {
          "indexed": false,
          "internalType": "uint256",
          "name": "nonce",
          "type": "uint256"
        },
        {
          "indexed": false,
          "internalType": "address",
          "name": "to",
          "type": "address"
        },
        {
          "indexed": false,
          "internalType": "uint256",
          "name": "value",
          "type": "uint256"
        },
        {
          "indexed": false,
          "internalType": "uint8",
          "name": "operation",
          "type": "uint8"
        },
        {
          "indexed": false,
          "internalType": "uint256",
          "name": "safeTxGas",
          "type": "uint256"
        },
        {
          "indexed": false,
          "internalType": "uint256",
          "name": "baseGas",
          "type": "uint256"
        },
        {
          "indexed": false,
          "internalType": "uint256",
          "name": "gasPrice",
          "type": "uint256"
        },
        {
          "indexed": false,
          "internalType": "address",
          "name": "gasToken",
          "type": "address"
        },
        {
          "indexed": false,
          "internalType": "address",
          "name": "refundReceiver",
          "type": "address"
        },
        {
          "indexed": false,
          "internalType": "bytes",
          "name": "data",
          "type": "bytes"
        }
      ],
      "name": "NewTransaction",
      "type": "event"
    },
    {
      "anonymous": false,
      "inputs": [
        {
          "indexed": true,
          "internalType": "address",
          "name": "signer",
          "type": "address"
        },
        {
          "indexed": true,
          "internalType": "address",
          "name": "safe",
          "type": "address"
        },
        {
          "indexed": true,
          "internalType": "bytes32",
          "name": "safeTxHash",
          "type": "bytes32"
        },
        {
          "indexed": false,
          "internalType": "uint256",
          "name": "chainId",
          "type": "uint256"
        },
        {
          "indexed": false,
          "internalType": "uint256",
          "name": "nonce",
          "type": "uint256"
        },
        {
          "indexed": false,
          "internalType": "uint256",
          "name": "listIndex",
          "type": "uint256"
        }
      ],
      "name": "SignatureStored",
      "type": "event"
    },
    {
      "inputs": [
        {
          "internalType": "address",
          "name": "safeAddress",
          "type": "address"
        },
        {
          "internalType": "uint256",
          "name": "chainId",
          "type": "uint256"
        },
        {
          "internalType": "uint256",
          "name": "nonce",
          "type": "uint256"
        },
        {
          "internalType": "address",
          "name": "to",
          "type": "address"
        },
        {
          "internalType": "uint256",
          "name": "value",
          "type": "uint256"
        },
        {
          "internalType": "bytes",
          "name": "data",
          "type": "bytes"
        },
        {
          "internalType": "uint8",
          "name": "operation",
          "type": "uint8"
        },
        {
          "internalType": "uint256",
          "name": "safeTxGas",
          "type": "uint256"
        },
        {
          "internalType": "uint256",
          "name": "baseGas",
          "type": "uint256"
        },
        {
          "internalType": "uint256",
          "name": "gasPrice",
          "type": "uint256"
        },
        {
          "internalType": "address",
          "name": "gasToken",
          "type": "address"
        },
        {
          "internalType": "address",
          "name": "refundReceiver",
          "type": "address"
        },
        {
          "internalType": "bytes",
          "name": "signature",
          "type": "bytes"
        }
      ],
      "name": "enqueueTransaction",
      "outputs": [
        {
          "internalType": "uint256",
          "name": "listIndex",
          "type": "uint256"
        }
      ],
      "stateMutability": "nonpayable",
      "type": "function"
    },
    {
      "inputs": [
        {
          "internalType": "address",
          "name": "signerAddress",
          "type": "address"
        },
        {
          "internalType": "address",
          "name": "safeAddress",
          "type": "address"
        },
        {
          "internalType": "uint256",
          "name": "chainId",
          "type": "uint256"
        },
        {
          "internalType": "uint256",
          "name": "nonce",
          "type": "uint256"
        },
        {
          "internalType": "uint256",
          "name": "start",
          "type": "uint256"
        },
        {
          "internalType": "uint256",
          "name": "count",
          "type": "uint256"
        }
      ],
      "name": "retrieveSignatures",
      "outputs": [
        {
          "components": [
            {
              "internalType": "bytes32",
              "name": "r",
              "type": "bytes32"
            },
            {
              "internalType": "bytes32",
              "name": "vs",
              "type": "bytes32"
            },
            {
              "internalType": "bytes32",
              "name": "txHash",
              "type": "bytes32"
            }
          ],
          "internalType": "struct SafeInternationalHarbour.SignatureDataWithTxHashIndex[]",
          "name": "page",
          "type": "tuple[]"
        },
        {
          "internalType": "uint256",
          "name": "totalCount",
          "type": "uint256"
        }
      ],
      "stateMutability": "view",
      "type": "function"
    },
    {
      "inputs": [
        {
          "internalType": "address",
          "name": "signerAddress",
          "type": "address"
        },
        {
          "internalType": "address",
          "name": "safeAddress",
          "type": "address"
        },
        {
          "internalType": "uint256",
          "name": "chainId",
          "type": "uint256"
        },
        {
          "internalType": "uint256",
          "name": "nonce",
          "type": "uint256"
        }
      ],
      "name": "retrieveSignaturesCount",
      "outputs": [
        {
          "internalType": "uint256",
          "name": "count",
          "type": "uint256"
        }
      ],
      "stateMutability": "view",
      "type": "function"
    },
    {
      "inputs": [
        {
          "internalType": "bytes32",
          "name": "safeTxHash",
          "type": "bytes32"
        }
      ],
      "name": "retrieveTransaction",
      "outputs": [
        {
          "components": [
            {
              "internalType": "bool",
              "name": "stored",
              "type": "bool"
            },
            {
              "internalType": "uint8",
              "name": "operation",
              "type": "uint8"
            },
            {
              "internalType": "address",
              "name": "to",
              "type": "address"
            },
            {
              "internalType": "uint128",
              "name": "value",
              "type": "uint128"
            },
            {
              "internalType": "uint128",
              "name": "safeTxGas",
              "type": "uint128"
            },
            {
              "internalType": "uint128",
              "name": "baseGas",
              "type": "uint128"
            },
            {
              "internalType": "uint128",
              "name": "gasPrice",
              "type": "uint128"
            },
            {
              "internalType": "address",
              "name": "gasToken",
              "type": "address"
            },
            {
              "internalType": "address",
              "name": "refundReceiver",
              "type": "address"
            },
            {
              "internalType": "bytes",
              "name": "data",
              "type": "bytes"
            }
          ],
          "internalType": "struct SafeInternationalHarbour.SafeTransaction",
          "name": "txParams",
          "type": "tuple"
        }
      ],
      "stateMutability": "view",
      "type": "function"
    }
  ],
  "transactionHash": "0xc17a536a9f9e8c6b2f1e04ef4329224f661e44def2f4de2f6e2140ffed2824b1",
  "receipt": {
    "to": "0x914d7Fec6aaC8cd542e72Bca78B30650d45643d7",
    "from": "0x02270bd144e70cE6963bA02F575776A16184E1E6",
    "contractAddress": null,
    "transactionIndex": 17,
    "gasUsed": "1215146",
    "logsBloom": "0x00000000000000010000000000000000000200000000001000000000000000000000000000000000000000000000000000008000000000000000000000000000000000000000000000000000000000800000000000000000000100000000000000000000000000000000000000000000000000000000000080000000000000000040000000040000000000000000000000000000000000000000000000000000200000000000000000000000000000000000000000000000000000000000004000000000000000000001000000000000000000000000000000120000000000000000000000000000000000000000000000000000000000000000000000100000",
    "blockHash": "0x66d351031e77c8d770d89f61198eb53bcb5d6f5bd292ebcd0eebfead812e5948",
    "transactionHash": "0xc17a536a9f9e8c6b2f1e04ef4329224f661e44def2f4de2f6e2140ffed2824b1",
    "logs": [
      {
        "transactionIndex": 17,
        "blockNumber": 71193848,
        "transactionHash": "0xc17a536a9f9e8c6b2f1e04ef4329224f661e44def2f4de2f6e2140ffed2824b1",
        "address": "0x0000000000000000000000000000000000001010",
        "topics": [
          "0x4dfe1bbbcf077ddc3e01291eea2d5c70c2b422b415d95645b9adcfd678cb1d63",
          "0x0000000000000000000000000000000000000000000000000000000000001010",
          "0x00000000000000000000000002270bd144e70ce6963ba02f575776a16184e1e6",
          "0x0000000000000000000000009ead03f7136fc6b4bdb0780b00a1c14ae5a8b6d0"
        ],
        "data": "0x000000000000000000000000000000000000000000000000008992d6c5e4978200000000000000000000000000000000000000000000000039e3fbf672401b8800000000000000000000000000000000000000000000050cadaaf30b62a58272000000000000000000000000000000000000000000000000395a691fac5b840600000000000000000000000000000000000000000000050cae3485e2288a19f4",
        "logIndex": 81,
        "blockHash": "0x66d351031e77c8d770d89f61198eb53bcb5d6f5bd292ebcd0eebfead812e5948"
      }
    ],
    "blockNumber": 71193848,
    "cumulativeGasUsed": "3232243",
    "status": 1,
    "byzantium": true
  },
  "args": [],
  "numDeployments": 1,
  "solcInputHash": "25465c993b4adbcef6ca93e38d5bb680",
  "metadata": "{\"compiler\":{\"version\":\"0.8.29+commit.ab55807c\"},\"language\":\"Solidity\",\"output\":{\"abi\":[{\"inputs\":[],\"name\":\"InvalidECDSASignatureLength\",\"type\":\"error\"},{\"inputs\":[],\"name\":\"InvalidSignature\",\"type\":\"error\"},{\"inputs\":[],\"name\":\"InvalidSignatureSValue\",\"type\":\"error\"},{\"inputs\":[{\"internalType\":\"address\",\"name\":\"signer\",\"type\":\"address\"},{\"internalType\":\"bytes32\",\"name\":\"safeTxHash\",\"type\":\"bytes32\"}],\"name\":\"SignerAlreadySignedTransaction\",\"type\":\"error\"},{\"inputs\":[],\"name\":\"ValueDoesNotFitInUint128\",\"type\":\"error\"},{\"anonymous\":false,\"inputs\":[{\"indexed\":true,\"internalType\":\"bytes32\",\"name\":\"safeTxHash\",\"type\":\"bytes32\"},{\"indexed\":true,\"internalType\":\"address\",\"name\":\"safe\",\"type\":\"address\"},{\"indexed\":true,\"internalType\":\"uint256\",\"name\":\"chainId\",\"type\":\"uint256\"},{\"indexed\":false,\"internalType\":\"uint256\",\"name\":\"nonce\",\"type\":\"uint256\"},{\"indexed\":false,\"internalType\":\"address\",\"name\":\"to\",\"type\":\"address\"},{\"indexed\":false,\"internalType\":\"uint256\",\"name\":\"value\",\"type\":\"uint256\"},{\"indexed\":false,\"internalType\":\"uint8\",\"name\":\"operation\",\"type\":\"uint8\"},{\"indexed\":false,\"internalType\":\"uint256\",\"name\":\"safeTxGas\",\"type\":\"uint256\"},{\"indexed\":false,\"internalType\":\"uint256\",\"name\":\"baseGas\",\"type\":\"uint256\"},{\"indexed\":false,\"internalType\":\"uint256\",\"name\":\"gasPrice\",\"type\":\"uint256\"},{\"indexed\":false,\"internalType\":\"address\",\"name\":\"gasToken\",\"type\":\"address\"},{\"indexed\":false,\"internalType\":\"address\",\"name\":\"refundReceiver\",\"type\":\"address\"},{\"indexed\":false,\"internalType\":\"bytes\",\"name\":\"data\",\"type\":\"bytes\"}],\"name\":\"NewTransaction\",\"type\":\"event\"},{\"anonymous\":false,\"inputs\":[{\"indexed\":true,\"internalType\":\"address\",\"name\":\"signer\",\"type\":\"address\"},{\"indexed\":true,\"internalType\":\"address\",\"name\":\"safe\",\"type\":\"address\"},{\"indexed\":true,\"internalType\":\"bytes32\",\"name\":\"safeTxHash\",\"type\":\"bytes32\"},{\"indexed\":false,\"internalType\":\"uint256\",\"name\":\"chainId\",\"type\":\"uint256\"},{\"indexed\":false,\"internalType\":\"uint256\",\"name\":\"nonce\",\"type\":\"uint256\"},{\"indexed\":false,\"internalType\":\"uint256\",\"name\":\"listIndex\",\"type\":\"uint256\"}],\"name\":\"SignatureStored\",\"type\":\"event\"},{\"inputs\":[{\"internalType\":\"address\",\"name\":\"safeAddress\",\"type\":\"address\"},{\"internalType\":\"uint256\",\"name\":\"chainId\",\"type\":\"uint256\"},{\"internalType\":\"uint256\",\"name\":\"nonce\",\"type\":\"uint256\"},{\"internalType\":\"address\",\"name\":\"to\",\"type\":\"address\"},{\"internalType\":\"uint256\",\"name\":\"value\",\"type\":\"uint256\"},{\"internalType\":\"bytes\",\"name\":\"data\",\"type\":\"bytes\"},{\"internalType\":\"uint8\",\"name\":\"operation\",\"type\":\"uint8\"},{\"internalType\":\"uint256\",\"name\":\"safeTxGas\",\"type\":\"uint256\"},{\"internalType\":\"uint256\",\"name\":\"baseGas\",\"type\":\"uint256\"},{\"internalType\":\"uint256\",\"name\":\"gasPrice\",\"type\":\"uint256\"},{\"internalType\":\"address\",\"name\":\"gasToken\",\"type\":\"address\"},{\"internalType\":\"address\",\"name\":\"refundReceiver\",\"type\":\"address\"},{\"internalType\":\"bytes\",\"name\":\"signature\",\"type\":\"bytes\"}],\"name\":\"enqueueTransaction\",\"outputs\":[{\"internalType\":\"uint256\",\"name\":\"listIndex\",\"type\":\"uint256\"}],\"stateMutability\":\"nonpayable\",\"type\":\"function\"},{\"inputs\":[{\"internalType\":\"address\",\"name\":\"signerAddress\",\"type\":\"address\"},{\"internalType\":\"address\",\"name\":\"safeAddress\",\"type\":\"address\"},{\"internalType\":\"uint256\",\"name\":\"chainId\",\"type\":\"uint256\"},{\"internalType\":\"uint256\",\"name\":\"nonce\",\"type\":\"uint256\"},{\"internalType\":\"uint256\",\"name\":\"start\",\"type\":\"uint256\"},{\"internalType\":\"uint256\",\"name\":\"count\",\"type\":\"uint256\"}],\"name\":\"retrieveSignatures\",\"outputs\":[{\"components\":[{\"internalType\":\"bytes32\",\"name\":\"r\",\"type\":\"bytes32\"},{\"internalType\":\"bytes32\",\"name\":\"vs\",\"type\":\"bytes32\"},{\"internalType\":\"bytes32\",\"name\":\"txHash\",\"type\":\"bytes32\"}],\"internalType\":\"struct SafeInternationalHarbour.SignatureDataWithTxHashIndex[]\",\"name\":\"page\",\"type\":\"tuple[]\"},{\"internalType\":\"uint256\",\"name\":\"totalCount\",\"type\":\"uint256\"}],\"stateMutability\":\"view\",\"type\":\"function\"},{\"inputs\":[{\"internalType\":\"address\",\"name\":\"signerAddress\",\"type\":\"address\"},{\"internalType\":\"address\",\"name\":\"safeAddress\",\"type\":\"address\"},{\"internalType\":\"uint256\",\"name\":\"chainId\",\"type\":\"uint256\"},{\"internalType\":\"uint256\",\"name\":\"nonce\",\"type\":\"uint256\"}],\"name\":\"retrieveSignaturesCount\",\"outputs\":[{\"internalType\":\"uint256\",\"name\":\"count\",\"type\":\"uint256\"}],\"stateMutability\":\"view\",\"type\":\"function\"},{\"inputs\":[{\"internalType\":\"bytes32\",\"name\":\"safeTxHash\",\"type\":\"bytes32\"}],\"name\":\"retrieveTransaction\",\"outputs\":[{\"components\":[{\"internalType\":\"bool\",\"name\":\"stored\",\"type\":\"bool\"},{\"internalType\":\"uint8\",\"name\":\"operation\",\"type\":\"uint8\"},{\"internalType\":\"address\",\"name\":\"to\",\"type\":\"address\"},{\"internalType\":\"uint128\",\"name\":\"value\",\"type\":\"uint128\"},{\"internalType\":\"uint128\",\"name\":\"safeTxGas\",\"type\":\"uint128\"},{\"internalType\":\"uint128\",\"name\":\"baseGas\",\"type\":\"uint128\"},{\"internalType\":\"uint128\",\"name\":\"gasPrice\",\"type\":\"uint128\"},{\"internalType\":\"address\",\"name\":\"gasToken\",\"type\":\"address\"},{\"internalType\":\"address\",\"name\":\"refundReceiver\",\"type\":\"address\"},{\"internalType\":\"bytes\",\"name\":\"data\",\"type\":\"bytes\"}],\"internalType\":\"struct SafeInternationalHarbour.SafeTransaction\",\"name\":\"txParams\",\"type\":\"tuple\"}],\"stateMutability\":\"view\",\"type\":\"function\"}],\"devdoc\":{\"details\":\"The {SignatureStored} event is the only hook required by indexers; however, the contract is      fully functional without any off\\u2011chain infrastructure.\",\"errors\":{\"SignerAlreadySignedTransaction(address,bytes32)\":[{\"params\":{\"safeTxHash\":\"The EIP-712 hash of the Safe transaction.\",\"signer\":\"Signer address.\"}}]},\"events\":{\"NewTransaction(bytes32,address,uint256,uint256,address,uint256,uint8,uint256,uint256,uint256,address,address,bytes)\":{\"params\":{\"baseGas\":\"Fixed overhead reimbursed to the submitting signer.\",\"chainId\":\"Intended execution chain.\",\"data\":\"Calldata executed by the Safe.\",\"gasPrice\":\"Gas price used for reimbursement.\",\"gasToken\":\"ERC-20 token address for refunds.\",\"nonce\":\"Safe nonce.\",\"operation\":\"0 = CALL, 1 = DELEGATECALL.\",\"refundReceiver\":\"Address receiving the gas refund.\",\"safe\":\"Safe Smart-Account the transaction targets.\",\"safeTxGas\":\"Gas forwarded to the inner call.\",\"safeTxHash\":\"EIP-712 hash identifying the SafeTx.\",\"to\":\"Destination of the inner call/delegatecall.\",\"value\":\"ETH value forwarded by the Safe.\"}},\"SignatureStored(address,address,bytes32,uint256,uint256,uint256)\":{\"params\":{\"chainId\":\"Intended execution chain.\",\"listIndex\":\"Position of the signature in the signer\\u2011specific array.\",\"nonce\":\"Safe nonce.\",\"safe\":\"Safe Smart\\u2011Account the transaction targets.\",\"safeTxHash\":\"EIP\\u2011712 hash identifying the SafeTx.\",\"signer\":\"Address recovered from the provided signature.\"}}},\"kind\":\"dev\",\"methods\":{\"enqueueTransaction(address,uint256,uint256,address,uint256,bytes,uint8,uint256,uint256,uint256,address,address,bytes)\":{\"custom:events\":\"Emits {SignatureStored}.\",\"details\":\"If `safeTxHash` has been seen before, its parameters are *not* validated nor overwritten \\u2013      the call simply appends the `(r,s)` pair for `signer`.\",\"params\":{\"baseGas\":\"Fixed overhead reimbursed to the submitting signer.\",\"chainId\":\"Chain id the transaction is meant for.\",\"data\":\"Calldata executed by the Safe.\",\"gasPrice\":\"Gas price used for reimbursement.\",\"gasToken\":\"ERC\\u201120 token address for refunds (`address(0)` = ETH).\",\"nonce\":\"Safe nonce.\",\"operation\":\"0 = CALL, 1 = DELEGATECALL.\",\"refundReceiver\":\"Address receiving the gas refund.\",\"safeAddress\":\"Target Safe Smart\\u2011Account.\",\"safeTxGas\":\"Gas forwarded to the inner call.\",\"signature\":\"**Single** 65\\u2011byte ECDSA signature.\",\"to\":\"Destination of the inner call/delegatecall.\",\"value\":\"ETH value forwarded by the Safe.\"},\"returns\":{\"listIndex\":\"    Index of the stored signature in the signer\\u2011specific list.\"}},\"retrieveSignatures(address,address,uint256,uint256,uint256,uint256)\":{\"params\":{\"chainId\":\"Target chain id.\",\"count\":\"Maximum number of entries to return.\",\"nonce\":\"Safe nonce.\",\"safeAddress\":\"Safe Smart\\u2011Account.\",\"signerAddress\":\"Address that created the signatures.\",\"start\":\"Zero\\u2011based start index of the slice.\"},\"returns\":{\"page\":\"      Array slice `[start \\u2026 start+count)` (may be shorter).\",\"totalCount\":\"Total number of signatures stored for the tuple.\"}},\"retrieveSignaturesCount(address,address,uint256,uint256)\":{\"params\":{\"chainId\":\"Target chain id.\",\"nonce\":\"Safe nonce.\",\"safeAddress\":\"Safe Smart\\u2011Account.\",\"signerAddress\":\"Signer address.\"},\"returns\":{\"count\":\"Length of the signature list.\"}},\"retrieveTransaction(bytes32)\":{\"params\":{\"safeTxHash\":\"EIP\\u2011712 digest of the transaction.\"},\"returns\":{\"txParams\":\"Struct with all SafeTx parameters (zero\\u2011initialised if unknown).\"}}},\"stateVariables\":{\"_hasSignerSignedTx\":{\"details\":\"Tracks if a signer has already submitted *any* signature for a specific safeTxHash,      preventing duplicate signatures for the *exact same* transaction digest.      This complements `_sigData` by ensuring uniqueness per (safeTxHash, signer) pair. Mapping `safeTxHash \\u2192 signer \\u2192 bool`\"}},\"title\":\"SafeInternationalHarbour\",\"version\":1},\"userdoc\":{\"errors\":{\"InvalidECDSASignatureLength()\":[{\"notice\":\"Thrown when a signature blob is not exactly 65 bytes.\"}],\"InvalidSignature()\":[{\"notice\":\"Thrown if `ecrecover` yields `address(0)`.\"}],\"InvalidSignatureSValue()\":[{\"notice\":\"Thrown if the S value of the signature is not from the lower half of the curve.\"}],\"SignerAlreadySignedTransaction(address,bytes32)\":[{\"notice\":\"Thrown when attempting to store a signature for a transaction (safeTxHash) that the signer has already provided a signature for.\"}],\"ValueDoesNotFitInUint128()\":[{\"notice\":\"Thrown when a value doesn't fit in a uint128.\"}]},\"events\":{\"NewTransaction(bytes32,address,uint256,uint256,address,uint256,uint8,uint256,uint256,uint256,address,address,bytes)\":{\"notice\":\"Emitted when a transaction is first stored.\"},\"SignatureStored(address,address,bytes32,uint256,uint256,uint256)\":{\"notice\":\"Emitted whenever a new signature is stored (and possibly the parameters on first sight).\"}},\"kind\":\"user\",\"methods\":{\"enqueueTransaction(address,uint256,uint256,address,uint256,bytes,uint8,uint256,uint256,uint256,address,address,bytes)\":{\"notice\":\"Publish a Safe transaction and/or append a signature to it.\"},\"retrieveSignatures(address,address,uint256,uint256,uint256,uint256)\":{\"notice\":\"Paginated getter for signature entries.\"},\"retrieveSignaturesCount(address,address,uint256,uint256)\":{\"notice\":\"Convenience getter returning the **number** of signatures stored for the key tuple.\"},\"retrieveTransaction(bytes32)\":{\"notice\":\"Retrieve the full parameter set of a Safe transaction.\"}},\"notice\":\"Permissionless, append\\u2011only registry that lets **any EOA signer** publish Safe         transactions (\\\"SafeTx\\\") and their signatures. Clients without an off\\u2011chain indexer can reconstruct the full multisig payload with only:         1. the Safe address;         2. the target `chainId`;         3. the Safe `nonce`; and         4. the current Safe owners set. Each unique `safeTxHash` (EIP\\u2011712 digest of the SafeTx struct) is persisted **once** together with its parameters. Signatures are appended under the composite key `(signer, safe, chainId, nonce)`, enabling on\\u2011chain, gas\\u2011efficient look\\u2011ups. ### \\u26a0\\ufe0f Contract\\u2011based signers unsupported Only ECDSA signatures from externally\\u2011owned accounts (EOAs) are supported. Contract wallets that rely on ERC\\u20111271 or similar cannot be verified on\\u2011chain in a chain\\u2011agnostic way and are therefore **not supported**.\",\"version\":1}},\"settings\":{\"compilationTarget\":{\"src/SafeInternationalHarbour.sol\":\"SafeInternationalHarbour\"},\"evmVersion\":\"paris\",\"libraries\":{},\"metadata\":{\"bytecodeHash\":\"ipfs\",\"useLiteralContent\":true},\"optimizer\":{\"enabled\":true,\"runs\":10000000},\"remappings\":[],\"viaIR\":true},\"sources\":{\"src/SafeInternationalHarbour.sol\":{\"content\":\"// SPDX-License-Identifier: GNU GPLv3\\npragma solidity ^0.8.29;\\n\\n/**\\n * @title SafeInternationalHarbour\\n * @notice Permissionless, append\\u2011only registry that lets **any EOA signer** publish Safe\\n *         transactions (\\\"SafeTx\\\") and their signatures. Clients without an off\\u2011chain indexer can reconstruct the full multisig payload with only:\\n *         1. the Safe address;\\n *         2. the target `chainId`;\\n *         3. the Safe `nonce`; and\\n *         4. the current Safe owners set.\\n *\\n * Each unique `safeTxHash` (EIP\\u2011712 digest of the SafeTx struct) is persisted **once** together with\\n * its parameters. Signatures are appended under the composite key\\n * `(signer, safe, chainId, nonce)`, enabling on\\u2011chain, gas\\u2011efficient look\\u2011ups.\\n *\\n * ### \\u26a0\\ufe0f Contract\\u2011based signers unsupported\\n * Only ECDSA signatures from externally\\u2011owned accounts (EOAs) are supported. Contract wallets that\\n * rely on ERC\\u20111271 or similar cannot be verified on\\u2011chain in a chain\\u2011agnostic way and are therefore\\n * **not supported**.\\n *\\n * @dev The {SignatureStored} event is the only hook required by indexers; however, the contract is\\n *      fully functional without any off\\u2011chain infrastructure.\\n */\\ncontract SafeInternationalHarbour {\\n    // ------------------------------------------------------------------\\n    // Errors\\n    // ------------------------------------------------------------------\\n\\n    /// Thrown when a signature blob is not exactly 65 bytes.\\n    error InvalidECDSASignatureLength();\\n\\n    /// Thrown if `ecrecover` yields `address(0)`.\\n    error InvalidSignature();\\n\\n    /// Thrown if the S value of the signature is not from the lower half of the curve.\\n    error InvalidSignatureSValue();\\n\\n    /// Thrown when a value doesn't fit in a uint128.\\n    error ValueDoesNotFitInUint128();\\n\\n    /// @notice Thrown when attempting to store a signature for a transaction (safeTxHash)\\n    /// that the signer has already provided a signature for.\\n    /// @param signer Signer address.\\n    /// @param safeTxHash The EIP-712 hash of the Safe transaction.\\n    error SignerAlreadySignedTransaction(address signer, bytes32 safeTxHash);\\n\\n    // ------------------------------------------------------------------\\n    // Constants\\n    // ------------------------------------------------------------------\\n\\n    /// The hashes must be the same as the ones in the Safe contract:\\n    /// https://github.com/safe-global/safe-smart-account/blob/b115c4c5fe23dca6aefeeccc73d312ddd23322c2/contracts/Safe.sol#L54-L63\\n    /// These should cover Safe versions 1.3.0 and 1.4.1\\n    /// keccak256(\\\"EIP712Domain(uint256 chainId,address verifyingContract)\\\")\\n    bytes32 private constant _DOMAIN_TYPEHASH =\\n        0x47e79534a245952e8b16893a336b85a3d9ea9fa8c573f3d803afb92a79469218;\\n\\n    /// keccak256(\\\"SafeTx(address to,uint256 value,bytes data,uint8 operation,uint256 safeTxGas,uint256 baseGas,uint256 gasPrice,address gasToken,address refundReceiver,uint256 nonce)\\\")\\n    bytes32 private constant _SAFE_TX_TYPEHASH =\\n        0xbb8310d486368db6bd6f849402fdd73ad53d316b5a4b2644ad6efe0f941286d8;\\n\\n    /// The lower bound of the S value for a valid secp256k1 signature.\\n    /// https://github.com/safe-global/safe-smart-account/blob/b115c4c5fe23dca6aefeeccc73d312ddd23322c2/contracts/Safe.sol#L100\\n    bytes32 private constant SECP256K1_LOW_S_BOUND =\\n        0x7FFFFFFFFFFFFFFFFFFFFFFFFFFFFFFF5D576E7357A4501DDFE92F46681B20A0;\\n\\n    // ------------------------------------------------------------------\\n    // Data structures\\n    // ------------------------------------------------------------------\\n\\n    /**\\n     * @dev Storage optimised mirror of the SafeTx struct used by Safe contracts.\\n     *      Non-optimised version uses uint256 for:\\n     *      - value\\n     *      - safeTxGas\\n     *      - baseGas\\n     *      - gasPrice\\n     */\\n    struct SafeTransaction {\\n        // stored, operation and to will be packed into the same storage slot\\n        bool stored;\\n        uint8 operation;\\n        address to;\\n        uint128 value;\\n        uint128 safeTxGas;\\n        uint128 baseGas;\\n        uint128 gasPrice;\\n        address gasToken;\\n        address refundReceiver;\\n        bytes data;\\n    }\\n\\n    /**\\n     * @dev Minimal, storage\\u2011optimised representation of an ECDSA signature.\\n     */\\n    struct SignatureDataWithTxHashIndex {\\n        bytes32 r;\\n        // vs is the compact representation of s and v coming from\\n        // EIP-2098: https://eips.ethereum.org/EIPS/eip-2098\\n        bytes32 vs;\\n        bytes32 txHash; // EIP\\u2011712 digest this signature belongs to\\n    }\\n\\n    // ------------------------------------------------------------------\\n    // Storage\\n    // ------------------------------------------------------------------\\n\\n    /// Mapping `safeTxHash \\u2192 SafeTransaction` parameters\\n    mapping(bytes32 => SafeTransaction) private _txDetails;\\n\\n    /// Mapping `signer \\u2192 safe \\u2192 chainId \\u2192 nonce \\u2192 SignatureDataWithTxHashIndex[]`\\n    /// Stores the list of signatures provided by a signer for a given Safe context.\\n    /// Note: A single list entry here could contain signatures for *different* `safeTxHash` values\\n    /// if those transactions share the same (safe, chainId, nonce). Use `_hasSignerSignedTx`\\n    /// to ensure a signer only signs a specific `safeTxHash` once.\\n    mapping(address signer => mapping(address safe => mapping(uint256 chainId => mapping(uint256 nonce => SignatureDataWithTxHashIndex[]))))\\n        private _sigData;\\n\\n    /// @dev Tracks if a signer has already submitted *any* signature for a specific safeTxHash,\\n    ///      preventing duplicate signatures for the *exact same* transaction digest.\\n    ///      This complements `_sigData` by ensuring uniqueness per (safeTxHash, signer) pair.\\n    /// Mapping `safeTxHash \\u2192 signer \\u2192 bool`\\n    mapping(bytes32 safeTxHash => mapping(address signer => bool))\\n        private _hasSignerSignedTx;\\n\\n    // ------------------------------------------------------------------\\n    // Events\\n    // ------------------------------------------------------------------\\n\\n    /**\\n     * @notice Emitted whenever a new signature is stored (and possibly the parameters on first sight).\\n     *\\n     * @param signer     Address recovered from the provided signature.\\n     * @param safe       Safe Smart\\u2011Account the transaction targets.\\n     * @param safeTxHash EIP\\u2011712 hash identifying the SafeTx.\\n     * @param chainId    Intended execution chain.\\n     * @param nonce      Safe nonce.\\n     * @param listIndex  Position of the signature in the signer\\u2011specific array.\\n     */\\n    event SignatureStored(\\n        address indexed signer,\\n        address indexed safe,\\n        bytes32 indexed safeTxHash,\\n        uint256 chainId,\\n        uint256 nonce,\\n        uint256 listIndex\\n    );\\n\\n    /**\\n     * @notice Emitted when a transaction is first stored.\\n     * @param safeTxHash EIP-712 hash identifying the SafeTx.\\n     * @param safe       Safe Smart-Account the transaction targets.\\n     * @param chainId    Intended execution chain.\\n     * @param nonce      Safe nonce.\\n     * @param to         Destination of the inner call/delegatecall.\\n     * @param value      ETH value forwarded by the Safe.\\n     * @param operation  0 = CALL, 1 = DELEGATECALL.\\n     * @param safeTxGas  Gas forwarded to the inner call.\\n     * @param baseGas    Fixed overhead reimbursed to the submitting signer.\\n     * @param gasPrice   Gas price used for reimbursement.\\n     * @param gasToken   ERC-20 token address for refunds.\\n     * @param refundReceiver Address receiving the gas refund.\\n     * @param data       Calldata executed by the Safe.\\n     */\\n    event NewTransaction(\\n        bytes32 indexed safeTxHash,\\n        address indexed safe,\\n        uint256 indexed chainId,\\n        uint256 nonce,\\n        address to,\\n        uint256 value,\\n        uint8 operation,\\n        uint256 safeTxGas,\\n        uint256 baseGas,\\n        uint256 gasPrice,\\n        address gasToken,\\n        address refundReceiver,\\n        bytes data\\n    );\\n\\n    // ------------------------------------------------------------------\\n    // External & public functions\\n    // ------------------------------------------------------------------\\n\\n    /**\\n     * @notice Publish a Safe transaction and/or append a signature to it.\\n     *\\n     * @dev If `safeTxHash` has been seen before, its parameters are *not* validated nor overwritten \\u2013\\n     *      the call simply appends the `(r,s)` pair for `signer`.\\n     *\\n     * @param safeAddress    Target Safe Smart\\u2011Account.\\n     * @param chainId        Chain id the transaction is meant for.\\n     * @param nonce          Safe nonce.\\n     * @param to             Destination of the inner call/delegatecall.\\n     * @param value          ETH value forwarded by the Safe.\\n     * @param data           Calldata executed by the Safe.\\n     * @param operation      0 = CALL, 1 = DELEGATECALL.\\n     * @param safeTxGas      Gas forwarded to the inner call.\\n     * @param baseGas        Fixed overhead reimbursed to the submitting signer.\\n     * @param gasPrice       Gas price used for reimbursement.\\n     * @param gasToken       ERC\\u201120 token address for refunds (`address(0)` = ETH).\\n     * @param refundReceiver Address receiving the gas refund.\\n     * @param signature      **Single** 65\\u2011byte ECDSA signature.\\n     *\\n     * @return listIndex     Index of the stored signature in the signer\\u2011specific list.\\n     *\\n     * @custom:events Emits {SignatureStored}.\\n     */\\n    function enqueueTransaction(\\n        address safeAddress,\\n        uint256 chainId,\\n        uint256 nonce,\\n        address to,\\n        uint256 value,\\n        bytes calldata data,\\n        uint8 operation,\\n        uint256 safeTxGas,\\n        uint256 baseGas,\\n        uint256 gasPrice,\\n        address gasToken,\\n        address refundReceiver,\\n        bytes calldata signature\\n    ) external returns (uint256 listIndex) {\\n        require(signature.length == 65, InvalidECDSASignatureLength());\\n\\n        // ------------------------------------------------------------------\\n        // Build the EIP\\u2011712 digest that uniquely identifies the SafeTx\\n        // ------------------------------------------------------------------\\n        bytes32 safeTxHash = _computeSafeTxHash(\\n            safeAddress,\\n            chainId,\\n            nonce,\\n            to,\\n            value,\\n            data,\\n            operation,\\n            safeTxGas,\\n            baseGas,\\n            gasPrice,\\n            gasToken,\\n            refundReceiver\\n        );\\n\\n        // Recover signer and split signature into (r,vs)\\n        (address signer, bytes32 r, bytes32 vs) = _recoverSigner(\\n            safeTxHash,\\n            signature\\n        );\\n\\n        // --- DUPLICATE TRANSACTION SIGNATURE CHECK ---\\n        // Revert if this signer has already submitted *any* signature for this *exact* safeTxHash\\n        require(\\n            !_hasSignerSignedTx[safeTxHash][signer],\\n            SignerAlreadySignedTransaction(signer, safeTxHash)\\n        );\\n\\n        // Store parameters only once (idempotent write)\\n        SafeTransaction storage slot = _txDetails[safeTxHash];\\n        if (!slot.stored) {\\n            // first encounter \\u2192 persist full parameter set\\n            slot.stored = true;\\n            slot.to = to;\\n            slot.operation = operation;\\n\\n            // Writing to storage is expensive, so we only write if the value is non-zero\\n            if (value > 0) {\\n                slot.value = _safeCastUint256ToUint128(value);\\n            }\\n            if (safeTxGas > 0) {\\n                slot.safeTxGas = _safeCastUint256ToUint128(safeTxGas);\\n            }\\n            if (baseGas > 0) {\\n                slot.baseGas = _safeCastUint256ToUint128(baseGas);\\n            }\\n            if (gasPrice > 0) {\\n                slot.gasPrice = _safeCastUint256ToUint128(gasPrice);\\n            }\\n            if (gasToken != address(0)) {\\n                slot.gasToken = gasToken;\\n            }\\n            if (refundReceiver != address(0)) {\\n                slot.refundReceiver = refundReceiver;\\n            }\\n            if (data.length > 0) {\\n                slot.data = data;\\n            }\\n\\n            emit NewTransaction(\\n                safeTxHash,\\n                safeAddress,\\n                chainId,\\n                nonce,\\n                to,\\n                value,\\n                operation,\\n                safeTxGas,\\n                baseGas,\\n                gasPrice,\\n                gasToken,\\n                refundReceiver,\\n                data\\n            );\\n        }\\n\\n        // Mark that this signer has now signed this specific transaction hash\\n        _hasSignerSignedTx[safeTxHash][signer] = true;\\n\\n        // Append the (r,vs) pair for this signer\\n        SignatureDataWithTxHashIndex[] storage list = _sigData[signer][\\n            safeAddress\\n        ][chainId][nonce];\\n        list.push(\\n            SignatureDataWithTxHashIndex({r: r, vs: vs, txHash: safeTxHash})\\n        );\\n        unchecked {\\n            listIndex = list.length - 1; // gas\\u2011free length\\u20111 because of unchecked\\n        }\\n\\n        emit SignatureStored(\\n            signer,\\n            safeAddress,\\n            safeTxHash,\\n            chainId,\\n            nonce,\\n            listIndex\\n        );\\n    }\\n\\n    /**\\n     * @notice Retrieve the full parameter set of a Safe transaction.\\n     *\\n     * @param safeTxHash EIP\\u2011712 digest of the transaction.\\n     *\\n     * @return txParams Struct with all SafeTx parameters (zero\\u2011initialised if unknown).\\n     */\\n    function retrieveTransaction(\\n        bytes32 safeTxHash\\n    ) external view returns (SafeTransaction memory txParams) {\\n        txParams = _txDetails[safeTxHash];\\n    }\\n\\n    /**\\n     * @notice Paginated getter for signature entries.\\n     *\\n     * @param signerAddress Address that created the signatures.\\n     * @param safeAddress   Safe Smart\\u2011Account.\\n     * @param chainId       Target chain id.\\n     * @param nonce         Safe nonce.\\n     * @param start         Zero\\u2011based start index of the slice.\\n     * @param count         Maximum number of entries to return.\\n     *\\n     * @return page       Array slice `[start \\u2026 start+count)` (may be shorter).\\n     * @return totalCount Total number of signatures stored for the tuple.\\n     */\\n    function retrieveSignatures(\\n        address signerAddress,\\n        address safeAddress,\\n        uint256 chainId,\\n        uint256 nonce,\\n        uint256 start,\\n        uint256 count\\n    )\\n        external\\n        view\\n        returns (SignatureDataWithTxHashIndex[] memory page, uint256 totalCount)\\n    {\\n        SignatureDataWithTxHashIndex[] storage all = _sigData[signerAddress][\\n            safeAddress\\n        ][chainId][nonce];\\n        totalCount = all.length;\\n        if (start >= totalCount)\\n            return (new SignatureDataWithTxHashIndex[](0), totalCount);\\n\\n        uint256 end = start + count;\\n        if (end > totalCount) end = totalCount;\\n        uint256 len = end - start;\\n\\n        page = new SignatureDataWithTxHashIndex[](len);\\n        for (uint256 i; i < len; ++i) {\\n            page[i] = all[start + i];\\n        }\\n    }\\n\\n    /**\\n     * @notice Convenience getter returning the **number** of signatures stored for the key tuple.\\n     *\\n     * @param signerAddress Signer address.\\n     * @param safeAddress   Safe Smart\\u2011Account.\\n     * @param chainId       Target chain id.\\n     * @param nonce         Safe nonce.\\n     *\\n     * @return count Length of the signature list.\\n     */\\n    function retrieveSignaturesCount(\\n        address signerAddress,\\n        address safeAddress,\\n        uint256 chainId,\\n        uint256 nonce\\n    ) external view returns (uint256 count) {\\n        count = _sigData[signerAddress][safeAddress][chainId][nonce].length;\\n    }\\n\\n    /**\\n     * @notice Computes the unique EIP-712 digest for a SafeTx using the provided parameters and domain.\\n     * @param safeAddress Address of the target Safe Smart Account.\\n     * @param chainId Chain ID included in the domain separator.\\n     * @param nonce Safe transaction nonce.\\n     * @param to Target address the Safe will call.\\n     * @param value ETH value to be sent with the call.\\n     * @param data Call data executed by the Safe.\\n     * @param operation Operation type: 0 = CALL, 1 = DELEGATECALL.\\n     * @param safeTxGas Gas limit for the Safe's internal execution.\\n     * @param baseGas Base gas overhead for reimbursement.\\n     * @param gasPrice Gas price used for reimbursement calculation.\\n     * @param gasToken Token address for refunds (0x0 for ETH).\\n     * @param refundReceiver Address to receive gas refunds.\\n     * @return safeTxHash Keccak256 digest of the EIP-712 encoded SafeTx.\\n     */\\n    function _computeSafeTxHash(\\n        address safeAddress,\\n        uint256 chainId,\\n        uint256 nonce,\\n        address to,\\n        uint256 value,\\n        bytes calldata data,\\n        uint8 operation,\\n        uint256 safeTxGas,\\n        uint256 baseGas,\\n        uint256 gasPrice,\\n        address gasToken,\\n        address refundReceiver\\n    ) private pure returns (bytes32 safeTxHash) {\\n        bytes32 domainSeparator = keccak256(\\n            abi.encode(_DOMAIN_TYPEHASH, chainId, safeAddress)\\n        );\\n        bytes32 structHash = keccak256(\\n            abi.encode(\\n                _SAFE_TX_TYPEHASH,\\n                to,\\n                value,\\n                keccak256(data),\\n                operation,\\n                safeTxGas,\\n                baseGas,\\n                gasPrice,\\n                gasToken,\\n                refundReceiver,\\n                nonce\\n            )\\n        );\\n        safeTxHash = keccak256(\\n            abi.encodePacked(\\\"\\\\x19\\\\x01\\\", domainSeparator, structHash)\\n        );\\n    }\\n\\n    /**\\n     * @notice Splits a 65-byte ECDSA signature into its components and recovers the signer address.\\n     * @param digest The message or data hash to verify (EIP-712 digest or eth_sign prefixed).\\n     * @param sig Concatenated 65-byte ECDSA signature (r || s || v).\\n     * @return signer The address that produced the signature (EOA).\\n     * @return r First 32 bytes of the ECDSA signature.\\n     * @return vs Compact representation of s and v coming from EIP-2098.\\n     * @dev Supports both EIP-712 and eth_sign flows by detecting v > 30 and applying the Ethereum Signed Message prefix.\\n     */\\n    function _recoverSigner(\\n        bytes32 digest,\\n        bytes calldata sig\\n    ) private pure returns (address signer, bytes32 r, bytes32 vs) {\\n        uint8 v;\\n        bytes32 s;\\n        // solhint-disable-next-line no-inline-assembly\\n        assembly (\\\"memory-safe\\\") {\\n            r := calldataload(sig.offset)\\n            s := calldataload(add(sig.offset, 0x20))\\n            v := byte(0, calldataload(add(sig.offset, 0x40)))\\n        }\\n        require(s <= SECP256K1_LOW_S_BOUND, InvalidSignatureSValue());\\n\\n        signer = ecrecover(digest, v, r, s);\\n        require(signer != address(0), InvalidSignature());\\n        // solhint-disable-next-line no-inline-assembly\\n        assembly (\\\"memory-safe\\\") {\\n            // Equivalent to:\\n            // vs = bytes32(uint256(v - 27)  << 255 | uint256(s));\\n            // Which should avoid conversion between uint256 and bytes32\\n            vs := or(shl(255, sub(v, 27)), s)\\n        }\\n    }\\n\\n    function _safeCastUint256ToUint128(\\n        uint256 value\\n    ) private pure returns (uint128) {\\n        require(value <= type(uint128).max, ValueDoesNotFitInUint128());\\n        return uint128(value);\\n    }\\n}\\n\",\"keccak256\":\"0xf03bc4bb2c9bfd5be3d8878ae197361404ae11ccf5febc7fc7e1e8f87e788286\",\"license\":\"GNU GPLv3\"}},\"version\":1}",
  "bytecode": "0x60808060405234601557611510908161001b8239f35b600080fdfe6080604052600436101561001257600080fd5b60003560e01c80631573a55d146110185780632220debb14610f6057806375f398fe14610bf25763dd030c671461004857600080fd5b34610bc3576101a07ffffffffffffffffffffffffffffffffffffffffffffffffffffffffffffffffc360112610bc3576100806110c4565b6064359073ffffffffffffffffffffffffffffffffffffffff82168203610bc35760a43567ffffffffffffffff8111610bc3576100c190369060040161110a565b9160ff60c4351660c43503610bc357610144359373ffffffffffffffffffffffffffffffffffffffff85168503610bc357610164359373ffffffffffffffffffffffffffffffffffffffff85168503610bc357610184359567ffffffffffffffff8711610bc357610138604197369060040161110a565b97909703610bc85760405160208101907f47e79534a245952e8b16893a336b85a3d9ea9fa8c573f3d803afb92a794692188252602435604082015273ffffffffffffffffffffffffffffffffffffffff861660608201526060815261019e608082611171565b51902067ffffffffffffffff83116105b0576040516101e560207fffffffffffffffffffffffffffffffffffffffffffffffffffffffffffffffe0601f8701160182611171565b83815260208101903685890111610bc3578488833760006020868301015251902060405160208101917fbb8310d486368db6bd6f849402fdd73ad53d316b5a4b2644ad6efe0f941286d8835273ffffffffffffffffffffffffffffffffffffffff871660408301526084356060830152608082015260ff60c4351660a082015260e43560c08201526101043560e08201526101243561010082015273ffffffffffffffffffffffffffffffffffffffff841661012082015273ffffffffffffffffffffffffffffffffffffffff891661014082015260443561016082015261016081526102d461018082611171565b5190206040519060208201927f19010000000000000000000000000000000000000000000000000000000000008452602283015260428201526042815261031c606282611171565b519020947f7fffffffffffffffffffffffffffffff5d576e7357a4501ddfe92f46681b20a0602089013511610b995760206000608060405189815260408c0135831a848201528b356040820152838c0135606082015282805260015afa15610b8d5773ffffffffffffffffffffffffffffffffffffffff60005116968715610b635786600052600260205260406000208860005260205260ff60406000205416610b315786600052600060205260406000209283549360ff8516156105df575b50505050505050816000526002602052604060002083600052602052604060002060017fffffffffffffffffffffffffffffffffffffffffffffffffffffffffffffff00825416179055826000526001602052604060002073ffffffffffffffffffffffffffffffffffffffff8216600052602052604060002060243560005260205260406000206044356000526020526040600020936040519461048086611155565b8135865260208601917fffffffffffffffffffffffffffffffffffffffffffffffffffffffffffffffe56040602083013592013560001a0160ff1b17825260408601958487528154680100000000000000008110156105b0578060016104e99201845583611206565b919091610581576020977fffffffffffffffffffffffffffffffffffffffffffffffffffffffffffffffff94600292518455516001840155519101555401927f8ca934463363b9653ec99615768595e2f35a0b21bab215117cf38b4038882c41606073ffffffffffffffffffffffffffffffffffffffff604051946024358652604435898701528760408701521693a4604051908152f35b7f4e487b7100000000000000000000000000000000000000000000000000000000600052600060045260246000fd5b7f4e487b7100000000000000000000000000000000000000000000000000000000600052604160045260246000fd5b859460017fffffffffffffffffffff0000000000000000000000000000000000000000000061ff0060c43560081b1692161775ffffffffffffffffffffffffffffffffffffffff00008960101b1617178155608435610ae3575b60e435610a8b575b61010435610a3c575b610124356109e3575b73ffffffffffffffffffffffffffffffffffffffff821661099c575b73ffffffffffffffffffffffffffffffffffffffff8316610955575b8461078d575b509073ffffffffffffffffffffffffffffffffffffffff809281604051986044358a52166020890152608435604089015260ff60c43516606089015260e43560808901526101043560a08901526101243560c08901521660e0870152166101008501526101406101208501528161014085015261016084013760006101608284010152837f3fcaf82260999b0a1a77f3006e142f8a15153ca131932b8b3b42ba67f44e02a360243593610160817fffffffffffffffffffffffffffffffffffffffffffffffffffffffffffffffe0601f73ffffffffffffffffffffffffffffffffffffffff8a169701168101030190a4388080808080806103dc565b600061079c6005830154611431565b601f81116108fd575b5080601f871160011461081c579160058773ffffffffffffffffffffffffffffffffffffffff969593879591610811575b508860011b907fffffffffffffffffffffffffffffffffffffffffffffffffffffffffffffffff8a60031b1c1916179101555b919250610691565b9050870135386107d6565b9060058301825260208220915b7fffffffffffffffffffffffffffffffffffffffffffffffffffffffffffffffe0881681106108e257509173ffffffffffffffffffffffffffffffffffffffff9493918593887fffffffffffffffffffffffffffffffffffffffffffffffffffffffffffffffe08116106108aa575b50506005600188811b01910155610809565b7fffffffffffffffffffffffffffffffffffffffffffffffffffffffffffffffff60f88a60031b161c19908801351690553880610898565b81870135835588975060019092019160209182019101610829565b9091929394955060058301825260208220601f880160051c81016020891061094e575b9088979695949392915b601f830160051c820181106109405750506107a5565b83815589985060010161092a565b5080610920565b6004810173ffffffffffffffffffffffffffffffffffffffff84167fffffffffffffffffffffffff000000000000000000000000000000000000000082541617905561068b565b6003810173ffffffffffffffffffffffffffffffffffffffff83167fffffffffffffffffffffffff000000000000000000000000000000000000000082541617905561066f565b610a376109f261012435611484565b60028301906fffffffffffffffffffffffffffffffff7fffffffffffffffffffffffffffffffff0000000000000000000000000000000083549260801b169116179055565b610653565b610a4861010435611484565b6fffffffffffffffffffffffffffffffff6002830191167fffffffffffffffffffffffffffffffff0000000000000000000000000000000082541617905561064a565b610ade610a9960e435611484565b60018301906fffffffffffffffffffffffffffffffff7fffffffffffffffffffffffffffffffff0000000000000000000000000000000083549260801b169116179055565b610641565b610aee608435611484565b6fffffffffffffffffffffffffffffffff6001830191167fffffffffffffffffffffffffffffffff00000000000000000000000000000000825416179055610639565b86887f41e3e8880000000000000000000000000000000000000000000000000000000060005260045260245260446000fd5b7f8baa579f0000000000000000000000000000000000000000000000000000000060005260046000fd5b6040513d6000823e3d90fd5b7f617cf4740000000000000000000000000000000000000000000000000000000060005260046000fd5b600080fd5b7f85e6258e0000000000000000000000000000000000000000000000000000000060005260046000fd5b34610bc35760207ffffffffffffffffffffffffffffffffffffffffffffffffffffffffffffffffc360112610bc3576060610120604051610c3281611138565b60008152600060208201526000604082015260008382015260006080820152600060a0820152600060c0820152600060e0820152600061010082015201526004356000526000602052604060002060405190610c8d82611138565b80549060ff821615158352602083019160ff8160081c16835273ffffffffffffffffffffffffffffffffffffffff604085019160101c1681526001820154606085016fffffffffffffffffffffffffffffffff82168152608086019160801c825260028401549160a08701916fffffffffffffffffffffffffffffffff8416835260c088019360801c845273ffffffffffffffffffffffffffffffffffffffff6003870154169460e08901958652600573ffffffffffffffffffffffffffffffffffffffff600489015416976101008b0198895201976040518099600090805490610d7782611431565b8085529160018116908115610f235750600114610ee6575b505003610d9c908a611171565b6101208a019889526040519960208b5251151560208b01525160ff1660408a01525173ffffffffffffffffffffffffffffffffffffffff166060890152516fffffffffffffffffffffffffffffffff166080880152516fffffffffffffffffffffffffffffffff1660a0870152516fffffffffffffffffffffffffffffffff1660c0860152516fffffffffffffffffffffffffffffffff1660e08501525173ffffffffffffffffffffffffffffffffffffffff166101008401525173ffffffffffffffffffffffffffffffffffffffff166101208301525161014082016101409052818151918261016083015260005b838110610ecd5750507fffffffffffffffffffffffffffffffffffffffffffffffffffffffffffffffe0601f83600061018080968601015201168101030190f35b6020828201810151610180878401015285935001610e8c565b6000908152602081209092505b818310610f0857505081016020018c80610d8f565b80602092948385600194549201015201910190918b92610ef3565b9050602093507fffffffffffffffffffffffffffffffffffffffffffffffffffffffffffffff0091501682840152151560051b8201018c80610d8f565b34610bc35760c07ffffffffffffffffffffffffffffffffffffffffffffffffffffffffffffffffc360112610bc357610fb8610f9a6110c4565b610fa26110e7565b9060a43591608435916064359160443591611265565b9060405190604082019260408352815180945260206060840192016000945b808610610fec57505082935060208301520390f35b909260206060600192604087518051835284810151858401520151604082015201940195019490610fd7565b34610bc35760807ffffffffffffffffffffffffffffffffffffffffffffffffffffffffffffffffc360112610bc35761104f6110c4565b73ffffffffffffffffffffffffffffffffffffffff61106c6110e7565b9116600052600160205273ffffffffffffffffffffffffffffffffffffffff60406000209116600052602052604060002060443560005260205260406000206064356000526020526020604060002054604051908152f35b6004359073ffffffffffffffffffffffffffffffffffffffff82168203610bc357565b6024359073ffffffffffffffffffffffffffffffffffffffff82168203610bc357565b9181601f84011215610bc35782359167ffffffffffffffff8311610bc35760208381860195010111610bc357565b610140810190811067ffffffffffffffff8211176105b057604052565b6060810190811067ffffffffffffffff8211176105b057604052565b90601f7fffffffffffffffffffffffffffffffffffffffffffffffffffffffffffffffe0910116810190811067ffffffffffffffff8211176105b057604052565b67ffffffffffffffff81116105b05760051b60200190565b919082018092116111d757565b7f4e487b7100000000000000000000000000000000000000000000000000000000600052601160045260246000fd5b8054821015611222576000526003602060002091020190600090565b7f4e487b7100000000000000000000000000000000000000000000000000000000600052603260045260246000fd5b80518210156112225760209160051b010190565b73ffffffffffffffffffffffffffffffffffffffff9096949616600052600160205273ffffffffffffffffffffffffffffffffffffffff604060002091166000526020526040600020906000526020526040600020906000526020526040600020805492838510156113dc576112db90856111ca565b908382116113d4575b8482039182116111d7576112f7826111b2565b906113056040519283611171565b8282527fffffffffffffffffffffffffffffffffffffffffffffffffffffffffffffffe0611332846111b2565b0160005b8181106113a8575050819560005b848110611352575050505050565b80611368611362600193856111ca565b85611206565b5060026040519161137883611155565b80548352848101546020840152015460408201526113968287611251565b526113a18186611251565b5001611344565b6020906040516113b781611155565b600081526000838201526000604082015282828701015201611336565b8391506112e4565b50506040519192509060006113f2602083611171565b81526000805b8181106114055750509190565b60209060405161141481611155565b6000815260008382015260006040820152828286010152016113f8565b90600182811c9216801561147a575b602083101461144b57565b7f4e487b7100000000000000000000000000000000000000000000000000000000600052602260045260246000fd5b91607f1691611440565b6fffffffffffffffffffffffffffffffff81116114b0576fffffffffffffffffffffffffffffffff1690565b7f5e978e240000000000000000000000000000000000000000000000000000000060005260046000fdfea2646970667358221220fb07a512145a1c00a451342e704c259f3274608a58b30350957a8ebeefb1f47664736f6c634300081d0033",
  "deployedBytecode": "0x6080604052600436101561001257600080fd5b60003560e01c80631573a55d146110185780632220debb14610f6057806375f398fe14610bf25763dd030c671461004857600080fd5b34610bc3576101a07ffffffffffffffffffffffffffffffffffffffffffffffffffffffffffffffffc360112610bc3576100806110c4565b6064359073ffffffffffffffffffffffffffffffffffffffff82168203610bc35760a43567ffffffffffffffff8111610bc3576100c190369060040161110a565b9160ff60c4351660c43503610bc357610144359373ffffffffffffffffffffffffffffffffffffffff85168503610bc357610164359373ffffffffffffffffffffffffffffffffffffffff85168503610bc357610184359567ffffffffffffffff8711610bc357610138604197369060040161110a565b97909703610bc85760405160208101907f47e79534a245952e8b16893a336b85a3d9ea9fa8c573f3d803afb92a794692188252602435604082015273ffffffffffffffffffffffffffffffffffffffff861660608201526060815261019e608082611171565b51902067ffffffffffffffff83116105b0576040516101e560207fffffffffffffffffffffffffffffffffffffffffffffffffffffffffffffffe0601f8701160182611171565b83815260208101903685890111610bc3578488833760006020868301015251902060405160208101917fbb8310d486368db6bd6f849402fdd73ad53d316b5a4b2644ad6efe0f941286d8835273ffffffffffffffffffffffffffffffffffffffff871660408301526084356060830152608082015260ff60c4351660a082015260e43560c08201526101043560e08201526101243561010082015273ffffffffffffffffffffffffffffffffffffffff841661012082015273ffffffffffffffffffffffffffffffffffffffff891661014082015260443561016082015261016081526102d461018082611171565b5190206040519060208201927f19010000000000000000000000000000000000000000000000000000000000008452602283015260428201526042815261031c606282611171565b519020947f7fffffffffffffffffffffffffffffff5d576e7357a4501ddfe92f46681b20a0602089013511610b995760206000608060405189815260408c0135831a848201528b356040820152838c0135606082015282805260015afa15610b8d5773ffffffffffffffffffffffffffffffffffffffff60005116968715610b635786600052600260205260406000208860005260205260ff60406000205416610b315786600052600060205260406000209283549360ff8516156105df575b50505050505050816000526002602052604060002083600052602052604060002060017fffffffffffffffffffffffffffffffffffffffffffffffffffffffffffffff00825416179055826000526001602052604060002073ffffffffffffffffffffffffffffffffffffffff8216600052602052604060002060243560005260205260406000206044356000526020526040600020936040519461048086611155565b8135865260208601917fffffffffffffffffffffffffffffffffffffffffffffffffffffffffffffffe56040602083013592013560001a0160ff1b17825260408601958487528154680100000000000000008110156105b0578060016104e99201845583611206565b919091610581576020977fffffffffffffffffffffffffffffffffffffffffffffffffffffffffffffffff94600292518455516001840155519101555401927f8ca934463363b9653ec99615768595e2f35a0b21bab215117cf38b4038882c41606073ffffffffffffffffffffffffffffffffffffffff604051946024358652604435898701528760408701521693a4604051908152f35b7f4e487b7100000000000000000000000000000000000000000000000000000000600052600060045260246000fd5b7f4e487b7100000000000000000000000000000000000000000000000000000000600052604160045260246000fd5b859460017fffffffffffffffffffff0000000000000000000000000000000000000000000061ff0060c43560081b1692161775ffffffffffffffffffffffffffffffffffffffff00008960101b1617178155608435610ae3575b60e435610a8b575b61010435610a3c575b610124356109e3575b73ffffffffffffffffffffffffffffffffffffffff821661099c575b73ffffffffffffffffffffffffffffffffffffffff8316610955575b8461078d575b509073ffffffffffffffffffffffffffffffffffffffff809281604051986044358a52166020890152608435604089015260ff60c43516606089015260e43560808901526101043560a08901526101243560c08901521660e0870152166101008501526101406101208501528161014085015261016084013760006101608284010152837f3fcaf82260999b0a1a77f3006e142f8a15153ca131932b8b3b42ba67f44e02a360243593610160817fffffffffffffffffffffffffffffffffffffffffffffffffffffffffffffffe0601f73ffffffffffffffffffffffffffffffffffffffff8a169701168101030190a4388080808080806103dc565b600061079c6005830154611431565b601f81116108fd575b5080601f871160011461081c579160058773ffffffffffffffffffffffffffffffffffffffff969593879591610811575b508860011b907fffffffffffffffffffffffffffffffffffffffffffffffffffffffffffffffff8a60031b1c1916179101555b919250610691565b9050870135386107d6565b9060058301825260208220915b7fffffffffffffffffffffffffffffffffffffffffffffffffffffffffffffffe0881681106108e257509173ffffffffffffffffffffffffffffffffffffffff9493918593887fffffffffffffffffffffffffffffffffffffffffffffffffffffffffffffffe08116106108aa575b50506005600188811b01910155610809565b7fffffffffffffffffffffffffffffffffffffffffffffffffffffffffffffffff60f88a60031b161c19908801351690553880610898565b81870135835588975060019092019160209182019101610829565b9091929394955060058301825260208220601f880160051c81016020891061094e575b9088979695949392915b601f830160051c820181106109405750506107a5565b83815589985060010161092a565b5080610920565b6004810173ffffffffffffffffffffffffffffffffffffffff84167fffffffffffffffffffffffff000000000000000000000000000000000000000082541617905561068b565b6003810173ffffffffffffffffffffffffffffffffffffffff83167fffffffffffffffffffffffff000000000000000000000000000000000000000082541617905561066f565b610a376109f261012435611484565b60028301906fffffffffffffffffffffffffffffffff7fffffffffffffffffffffffffffffffff0000000000000000000000000000000083549260801b169116179055565b610653565b610a4861010435611484565b6fffffffffffffffffffffffffffffffff6002830191167fffffffffffffffffffffffffffffffff0000000000000000000000000000000082541617905561064a565b610ade610a9960e435611484565b60018301906fffffffffffffffffffffffffffffffff7fffffffffffffffffffffffffffffffff0000000000000000000000000000000083549260801b169116179055565b610641565b610aee608435611484565b6fffffffffffffffffffffffffffffffff6001830191167fffffffffffffffffffffffffffffffff00000000000000000000000000000000825416179055610639565b86887f41e3e8880000000000000000000000000000000000000000000000000000000060005260045260245260446000fd5b7f8baa579f0000000000000000000000000000000000000000000000000000000060005260046000fd5b6040513d6000823e3d90fd5b7f617cf4740000000000000000000000000000000000000000000000000000000060005260046000fd5b600080fd5b7f85e6258e0000000000000000000000000000000000000000000000000000000060005260046000fd5b34610bc35760207ffffffffffffffffffffffffffffffffffffffffffffffffffffffffffffffffc360112610bc3576060610120604051610c3281611138565b60008152600060208201526000604082015260008382015260006080820152600060a0820152600060c0820152600060e0820152600061010082015201526004356000526000602052604060002060405190610c8d82611138565b80549060ff821615158352602083019160ff8160081c16835273ffffffffffffffffffffffffffffffffffffffff604085019160101c1681526001820154606085016fffffffffffffffffffffffffffffffff82168152608086019160801c825260028401549160a08701916fffffffffffffffffffffffffffffffff8416835260c088019360801c845273ffffffffffffffffffffffffffffffffffffffff6003870154169460e08901958652600573ffffffffffffffffffffffffffffffffffffffff600489015416976101008b0198895201976040518099600090805490610d7782611431565b8085529160018116908115610f235750600114610ee6575b505003610d9c908a611171565b6101208a019889526040519960208b5251151560208b01525160ff1660408a01525173ffffffffffffffffffffffffffffffffffffffff166060890152516fffffffffffffffffffffffffffffffff166080880152516fffffffffffffffffffffffffffffffff1660a0870152516fffffffffffffffffffffffffffffffff1660c0860152516fffffffffffffffffffffffffffffffff1660e08501525173ffffffffffffffffffffffffffffffffffffffff166101008401525173ffffffffffffffffffffffffffffffffffffffff166101208301525161014082016101409052818151918261016083015260005b838110610ecd5750507fffffffffffffffffffffffffffffffffffffffffffffffffffffffffffffffe0601f83600061018080968601015201168101030190f35b6020828201810151610180878401015285935001610e8c565b6000908152602081209092505b818310610f0857505081016020018c80610d8f565b80602092948385600194549201015201910190918b92610ef3565b9050602093507fffffffffffffffffffffffffffffffffffffffffffffffffffffffffffffff0091501682840152151560051b8201018c80610d8f565b34610bc35760c07ffffffffffffffffffffffffffffffffffffffffffffffffffffffffffffffffc360112610bc357610fb8610f9a6110c4565b610fa26110e7565b9060a43591608435916064359160443591611265565b9060405190604082019260408352815180945260206060840192016000945b808610610fec57505082935060208301520390f35b909260206060600192604087518051835284810151858401520151604082015201940195019490610fd7565b34610bc35760807ffffffffffffffffffffffffffffffffffffffffffffffffffffffffffffffffc360112610bc35761104f6110c4565b73ffffffffffffffffffffffffffffffffffffffff61106c6110e7565b9116600052600160205273ffffffffffffffffffffffffffffffffffffffff60406000209116600052602052604060002060443560005260205260406000206064356000526020526020604060002054604051908152f35b6004359073ffffffffffffffffffffffffffffffffffffffff82168203610bc357565b6024359073ffffffffffffffffffffffffffffffffffffffff82168203610bc357565b9181601f84011215610bc35782359167ffffffffffffffff8311610bc35760208381860195010111610bc357565b610140810190811067ffffffffffffffff8211176105b057604052565b6060810190811067ffffffffffffffff8211176105b057604052565b90601f7fffffffffffffffffffffffffffffffffffffffffffffffffffffffffffffffe0910116810190811067ffffffffffffffff8211176105b057604052565b67ffffffffffffffff81116105b05760051b60200190565b919082018092116111d757565b7f4e487b7100000000000000000000000000000000000000000000000000000000600052601160045260246000fd5b8054821015611222576000526003602060002091020190600090565b7f4e487b7100000000000000000000000000000000000000000000000000000000600052603260045260246000fd5b80518210156112225760209160051b010190565b73ffffffffffffffffffffffffffffffffffffffff9096949616600052600160205273ffffffffffffffffffffffffffffffffffffffff604060002091166000526020526040600020906000526020526040600020906000526020526040600020805492838510156113dc576112db90856111ca565b908382116113d4575b8482039182116111d7576112f7826111b2565b906113056040519283611171565b8282527fffffffffffffffffffffffffffffffffffffffffffffffffffffffffffffffe0611332846111b2565b0160005b8181106113a8575050819560005b848110611352575050505050565b80611368611362600193856111ca565b85611206565b5060026040519161137883611155565b80548352848101546020840152015460408201526113968287611251565b526113a18186611251565b5001611344565b6020906040516113b781611155565b600081526000838201526000604082015282828701015201611336565b8391506112e4565b50506040519192509060006113f2602083611171565b81526000805b8181106114055750509190565b60209060405161141481611155565b6000815260008382015260006040820152828286010152016113f8565b90600182811c9216801561147a575b602083101461144b57565b7f4e487b7100000000000000000000000000000000000000000000000000000000600052602260045260246000fd5b91607f1691611440565b6fffffffffffffffffffffffffffffffff81116114b0576fffffffffffffffffffffffffffffffff1690565b7f5e978e240000000000000000000000000000000000000000000000000000000060005260046000fdfea2646970667358221220fb07a512145a1c00a451342e704c259f3274608a58b30350957a8ebeefb1f47664736f6c634300081d0033",
  "devdoc": {
    "details": "The {SignatureStored} event is the only hook required by indexers; however, the contract is      fully functional without any off‑chain infrastructure.",
    "errors": {
      "SignerAlreadySignedTransaction(address,bytes32)": [
        {
          "params": {
            "safeTxHash": "The EIP-712 hash of the Safe transaction.",
            "signer": "Signer address."
          }
        }
      ]
    },
    "events": {
      "NewTransaction(bytes32,address,uint256,uint256,address,uint256,uint8,uint256,uint256,uint256,address,address,bytes)": {
        "params": {
          "baseGas": "Fixed overhead reimbursed to the submitting signer.",
          "chainId": "Intended execution chain.",
          "data": "Calldata executed by the Safe.",
          "gasPrice": "Gas price used for reimbursement.",
          "gasToken": "ERC-20 token address for refunds.",
          "nonce": "Safe nonce.",
          "operation": "0 = CALL, 1 = DELEGATECALL.",
          "refundReceiver": "Address receiving the gas refund.",
          "safe": "Safe Smart-Account the transaction targets.",
          "safeTxGas": "Gas forwarded to the inner call.",
          "safeTxHash": "EIP-712 hash identifying the SafeTx.",
          "to": "Destination of the inner call/delegatecall.",
          "value": "ETH value forwarded by the Safe."
        }
      },
      "SignatureStored(address,address,bytes32,uint256,uint256,uint256)": {
        "params": {
          "chainId": "Intended execution chain.",
          "listIndex": "Position of the signature in the signer‑specific array.",
          "nonce": "Safe nonce.",
          "safe": "Safe Smart‑Account the transaction targets.",
          "safeTxHash": "EIP‑712 hash identifying the SafeTx.",
          "signer": "Address recovered from the provided signature."
        }
      }
    },
    "kind": "dev",
    "methods": {
      "enqueueTransaction(address,uint256,uint256,address,uint256,bytes,uint8,uint256,uint256,uint256,address,address,bytes)": {
        "custom:events": "Emits {SignatureStored}.",
        "details": "If `safeTxHash` has been seen before, its parameters are *not* validated nor overwritten –      the call simply appends the `(r,s)` pair for `signer`.",
        "params": {
          "baseGas": "Fixed overhead reimbursed to the submitting signer.",
          "chainId": "Chain id the transaction is meant for.",
          "data": "Calldata executed by the Safe.",
          "gasPrice": "Gas price used for reimbursement.",
          "gasToken": "ERC‑20 token address for refunds (`address(0)` = ETH).",
          "nonce": "Safe nonce.",
          "operation": "0 = CALL, 1 = DELEGATECALL.",
          "refundReceiver": "Address receiving the gas refund.",
          "safeAddress": "Target Safe Smart‑Account.",
          "safeTxGas": "Gas forwarded to the inner call.",
          "signature": "**Single** 65‑byte ECDSA signature.",
          "to": "Destination of the inner call/delegatecall.",
          "value": "ETH value forwarded by the Safe."
        },
        "returns": {
          "listIndex": "    Index of the stored signature in the signer‑specific list."
        }
      },
      "retrieveSignatures(address,address,uint256,uint256,uint256,uint256)": {
        "params": {
          "chainId": "Target chain id.",
          "count": "Maximum number of entries to return.",
          "nonce": "Safe nonce.",
          "safeAddress": "Safe Smart‑Account.",
          "signerAddress": "Address that created the signatures.",
          "start": "Zero‑based start index of the slice."
        },
        "returns": {
          "page": "      Array slice `[start … start+count)` (may be shorter).",
          "totalCount": "Total number of signatures stored for the tuple."
        }
      },
      "retrieveSignaturesCount(address,address,uint256,uint256)": {
        "params": {
          "chainId": "Target chain id.",
          "nonce": "Safe nonce.",
          "safeAddress": "Safe Smart‑Account.",
          "signerAddress": "Signer address."
        },
        "returns": {
          "count": "Length of the signature list."
        }
      },
      "retrieveTransaction(bytes32)": {
        "params": {
          "safeTxHash": "EIP‑712 digest of the transaction."
        },
        "returns": {
          "txParams": "Struct with all SafeTx parameters (zero‑initialised if unknown)."
        }
      }
    },
    "stateVariables": {
      "_hasSignerSignedTx": {
        "details": "Tracks if a signer has already submitted *any* signature for a specific safeTxHash,      preventing duplicate signatures for the *exact same* transaction digest.      This complements `_sigData` by ensuring uniqueness per (safeTxHash, signer) pair. Mapping `safeTxHash → signer → bool`"
      }
    },
    "title": "SafeInternationalHarbour",
    "version": 1
  },
  "userdoc": {
    "errors": {
      "InvalidECDSASignatureLength()": [
        {
          "notice": "Thrown when a signature blob is not exactly 65 bytes."
        }
      ],
      "InvalidSignature()": [
        {
          "notice": "Thrown if `ecrecover` yields `address(0)`."
        }
      ],
      "InvalidSignatureSValue()": [
        {
          "notice": "Thrown if the S value of the signature is not from the lower half of the curve."
        }
      ],
      "SignerAlreadySignedTransaction(address,bytes32)": [
        {
          "notice": "Thrown when attempting to store a signature for a transaction (safeTxHash) that the signer has already provided a signature for."
        }
      ],
      "ValueDoesNotFitInUint128()": [
        {
          "notice": "Thrown when a value doesn't fit in a uint128."
        }
      ]
    },
    "events": {
      "NewTransaction(bytes32,address,uint256,uint256,address,uint256,uint8,uint256,uint256,uint256,address,address,bytes)": {
        "notice": "Emitted when a transaction is first stored."
      },
      "SignatureStored(address,address,bytes32,uint256,uint256,uint256)": {
        "notice": "Emitted whenever a new signature is stored (and possibly the parameters on first sight)."
      }
    },
    "kind": "user",
    "methods": {
      "enqueueTransaction(address,uint256,uint256,address,uint256,bytes,uint8,uint256,uint256,uint256,address,address,bytes)": {
        "notice": "Publish a Safe transaction and/or append a signature to it."
      },
      "retrieveSignatures(address,address,uint256,uint256,uint256,uint256)": {
        "notice": "Paginated getter for signature entries."
      },
      "retrieveSignaturesCount(address,address,uint256,uint256)": {
        "notice": "Convenience getter returning the **number** of signatures stored for the key tuple."
      },
      "retrieveTransaction(bytes32)": {
        "notice": "Retrieve the full parameter set of a Safe transaction."
      }
    },
    "notice": "Permissionless, append‑only registry that lets **any EOA signer** publish Safe         transactions (\"SafeTx\") and their signatures. Clients without an off‑chain indexer can reconstruct the full multisig payload with only:         1. the Safe address;         2. the target `chainId`;         3. the Safe `nonce`; and         4. the current Safe owners set. Each unique `safeTxHash` (EIP‑712 digest of the SafeTx struct) is persisted **once** together with its parameters. Signatures are appended under the composite key `(signer, safe, chainId, nonce)`, enabling on‑chain, gas‑efficient look‑ups. ### ⚠️ Contract‑based signers unsupported Only ECDSA signatures from externally‑owned accounts (EOAs) are supported. Contract wallets that rely on ERC‑1271 or similar cannot be verified on‑chain in a chain‑agnostic way and are therefore **not supported**.",
    "version": 1
  },
  "storageLayout": {
    "storage": [
      {
        "astId": 69,
        "contract": "src/SafeInternationalHarbour.sol:SafeInternationalHarbour",
        "label": "_txDetails",
        "offset": 0,
        "slot": "0",
        "type": "t_mapping(t_bytes32,t_struct(SafeTransaction)55_storage)"
      },
      {
        "astId": 82,
        "contract": "src/SafeInternationalHarbour.sol:SafeInternationalHarbour",
        "label": "_sigData",
        "offset": 0,
        "slot": "1",
        "type": "t_mapping(t_address,t_mapping(t_address,t_mapping(t_uint256,t_mapping(t_uint256,t_array(t_struct(SignatureDataWithTxHashIndex)63_storage)dyn_storage))))"
      },
      {
        "astId": 89,
        "contract": "src/SafeInternationalHarbour.sol:SafeInternationalHarbour",
        "label": "_hasSignerSignedTx",
        "offset": 0,
        "slot": "2",
        "type": "t_mapping(t_bytes32,t_mapping(t_address,t_bool))"
      }
    ],
    "types": {
      "t_address": {
        "encoding": "inplace",
        "label": "address",
        "numberOfBytes": "20"
      },
      "t_array(t_struct(SignatureDataWithTxHashIndex)63_storage)dyn_storage": {
        "base": "t_struct(SignatureDataWithTxHashIndex)63_storage",
        "encoding": "dynamic_array",
        "label": "struct SafeInternationalHarbour.SignatureDataWithTxHashIndex[]",
        "numberOfBytes": "32"
      },
      "t_bool": {
        "encoding": "inplace",
        "label": "bool",
        "numberOfBytes": "1"
      },
      "t_bytes32": {
        "encoding": "inplace",
        "label": "bytes32",
        "numberOfBytes": "32"
      },
      "t_bytes_storage": {
        "encoding": "bytes",
        "label": "bytes",
        "numberOfBytes": "32"
      },
      "t_mapping(t_address,t_bool)": {
        "encoding": "mapping",
        "key": "t_address",
        "label": "mapping(address => bool)",
        "numberOfBytes": "32",
        "value": "t_bool"
      },
      "t_mapping(t_address,t_mapping(t_address,t_mapping(t_uint256,t_mapping(t_uint256,t_array(t_struct(SignatureDataWithTxHashIndex)63_storage)dyn_storage))))": {
        "encoding": "mapping",
        "key": "t_address",
        "label": "mapping(address => mapping(address => mapping(uint256 => mapping(uint256 => struct SafeInternationalHarbour.SignatureDataWithTxHashIndex[]))))",
        "numberOfBytes": "32",
        "value": "t_mapping(t_address,t_mapping(t_uint256,t_mapping(t_uint256,t_array(t_struct(SignatureDataWithTxHashIndex)63_storage)dyn_storage)))"
      },
      "t_mapping(t_address,t_mapping(t_uint256,t_mapping(t_uint256,t_array(t_struct(SignatureDataWithTxHashIndex)63_storage)dyn_storage)))": {
        "encoding": "mapping",
        "key": "t_address",
        "label": "mapping(address => mapping(uint256 => mapping(uint256 => struct SafeInternationalHarbour.SignatureDataWithTxHashIndex[])))",
        "numberOfBytes": "32",
        "value": "t_mapping(t_uint256,t_mapping(t_uint256,t_array(t_struct(SignatureDataWithTxHashIndex)63_storage)dyn_storage))"
      },
      "t_mapping(t_bytes32,t_mapping(t_address,t_bool))": {
        "encoding": "mapping",
        "key": "t_bytes32",
        "label": "mapping(bytes32 => mapping(address => bool))",
        "numberOfBytes": "32",
        "value": "t_mapping(t_address,t_bool)"
      },
      "t_mapping(t_bytes32,t_struct(SafeTransaction)55_storage)": {
        "encoding": "mapping",
        "key": "t_bytes32",
        "label": "mapping(bytes32 => struct SafeInternationalHarbour.SafeTransaction)",
        "numberOfBytes": "32",
        "value": "t_struct(SafeTransaction)55_storage"
      },
      "t_mapping(t_uint256,t_array(t_struct(SignatureDataWithTxHashIndex)63_storage)dyn_storage)": {
        "encoding": "mapping",
        "key": "t_uint256",
        "label": "mapping(uint256 => struct SafeInternationalHarbour.SignatureDataWithTxHashIndex[])",
        "numberOfBytes": "32",
        "value": "t_array(t_struct(SignatureDataWithTxHashIndex)63_storage)dyn_storage"
      },
      "t_mapping(t_uint256,t_mapping(t_uint256,t_array(t_struct(SignatureDataWithTxHashIndex)63_storage)dyn_storage))": {
        "encoding": "mapping",
        "key": "t_uint256",
        "label": "mapping(uint256 => mapping(uint256 => struct SafeInternationalHarbour.SignatureDataWithTxHashIndex[]))",
        "numberOfBytes": "32",
        "value": "t_mapping(t_uint256,t_array(t_struct(SignatureDataWithTxHashIndex)63_storage)dyn_storage)"
      },
      "t_struct(SafeTransaction)55_storage": {
        "encoding": "inplace",
        "label": "struct SafeInternationalHarbour.SafeTransaction",
        "members": [
          {
            "astId": 36,
            "contract": "src/SafeInternationalHarbour.sol:SafeInternationalHarbour",
            "label": "stored",
            "offset": 0,
            "slot": "0",
            "type": "t_bool"
          },
          {
            "astId": 38,
            "contract": "src/SafeInternationalHarbour.sol:SafeInternationalHarbour",
            "label": "operation",
            "offset": 1,
            "slot": "0",
            "type": "t_uint8"
          },
          {
            "astId": 40,
            "contract": "src/SafeInternationalHarbour.sol:SafeInternationalHarbour",
            "label": "to",
            "offset": 2,
            "slot": "0",
            "type": "t_address"
          },
          {
            "astId": 42,
            "contract": "src/SafeInternationalHarbour.sol:SafeInternationalHarbour",
            "label": "value",
            "offset": 0,
            "slot": "1",
            "type": "t_uint128"
          },
          {
            "astId": 44,
            "contract": "src/SafeInternationalHarbour.sol:SafeInternationalHarbour",
            "label": "safeTxGas",
            "offset": 16,
            "slot": "1",
            "type": "t_uint128"
          },
          {
            "astId": 46,
            "contract": "src/SafeInternationalHarbour.sol:SafeInternationalHarbour",
            "label": "baseGas",
            "offset": 0,
            "slot": "2",
            "type": "t_uint128"
          },
          {
            "astId": 48,
            "contract": "src/SafeInternationalHarbour.sol:SafeInternationalHarbour",
            "label": "gasPrice",
            "offset": 16,
            "slot": "2",
            "type": "t_uint128"
          },
          {
            "astId": 50,
            "contract": "src/SafeInternationalHarbour.sol:SafeInternationalHarbour",
            "label": "gasToken",
            "offset": 0,
            "slot": "3",
            "type": "t_address"
          },
          {
            "astId": 52,
            "contract": "src/SafeInternationalHarbour.sol:SafeInternationalHarbour",
            "label": "refundReceiver",
            "offset": 0,
            "slot": "4",
            "type": "t_address"
          },
          {
            "astId": 54,
            "contract": "src/SafeInternationalHarbour.sol:SafeInternationalHarbour",
            "label": "data",
            "offset": 0,
            "slot": "5",
            "type": "t_bytes_storage"
          }
        ],
        "numberOfBytes": "192"
      },
      "t_struct(SignatureDataWithTxHashIndex)63_storage": {
        "encoding": "inplace",
        "label": "struct SafeInternationalHarbour.SignatureDataWithTxHashIndex",
        "members": [
          {
            "astId": 58,
            "contract": "src/SafeInternationalHarbour.sol:SafeInternationalHarbour",
            "label": "r",
            "offset": 0,
            "slot": "0",
            "type": "t_bytes32"
          },
          {
            "astId": 60,
            "contract": "src/SafeInternationalHarbour.sol:SafeInternationalHarbour",
            "label": "vs",
            "offset": 0,
            "slot": "1",
            "type": "t_bytes32"
          },
          {
            "astId": 62,
            "contract": "src/SafeInternationalHarbour.sol:SafeInternationalHarbour",
            "label": "txHash",
            "offset": 0,
            "slot": "2",
            "type": "t_bytes32"
          }
        ],
        "numberOfBytes": "96"
      },
      "t_uint128": {
        "encoding": "inplace",
        "label": "uint128",
        "numberOfBytes": "16"
      },
      "t_uint256": {
        "encoding": "inplace",
        "label": "uint256",
        "numberOfBytes": "32"
      },
      "t_uint8": {
        "encoding": "inplace",
        "label": "uint8",
        "numberOfBytes": "1"
      }
    }
  }
}